[
  {
    "task_id": "synthetic-0",
    "started_at": "2025-01-01T00:00:00+00:00",
    "finished_at": "2025-01-01T01:00:00+00:00",
    "failed": false,
    "plan_recorded_at": "2025-01-01T00:00:00+00:00",
    "outcome_recorded_at": "2025-01-01T01:00:00+00:00",
    "plan": {
      "goal": "Synthetic test",
      "acceptance": [
        "Result recorded"
      ],
      "steps": [
        {
          "id": "one",
          "description": "inspect local configuration"
        }
      ]
    },
    "tools_used": [],
    "failure_type": ""
  },
  {
    "task_id": "synthetic-1",
    "started_at": "2025-01-01T02:00:00+00:00",
    "finished_at": "2025-01-01T03:00:00+00:00",
    "failed": true,
    "plan_recorded_at": "2025-01-01T02:00:00+00:00",
    "outcome_recorded_at": "2025-01-01T03:00:00+00:00",
    "plan": {
      "goal": "Synthetic test",
      "acceptance": [
        "Result recorded"
      ],
      "steps": [
        {
          "id": "one",
          "description": "deploy production"
        }
      ]
    },
    "tools_used": [],
    "failure_type": "synthetic_only"
  },
  {
    "task_id": "synthetic-2",
    "started_at": "2025-01-01T04:00:00+00:00",
    "finished_at": "2025-01-01T05:00:00+00:00",
    "failed": false,
    "plan_recorded_at": "2025-01-01T04:00:00+00:00",
    "outcome_recorded_at": "2025-01-01T05:00:00+00:00",
    "plan": {
      "goal": "Synthetic test",
      "acceptance": [
        "Result recorded"
      ],
      "steps": [
        {
          "id": "one",
          "description": "inspect local configuration"
        }
      ]
    },
    "tools_used": [],
    "failure_type": ""
  },
  {
    "task_id": "synthetic-3",
    "started_at": "2025-01-01T06:00:00+00:00",
    "finished_at": "2025-01-01T07:00:00+00:00",
    "failed": true,
    "plan_recorded_at": "2025-01-01T06:00:00+00:00",
    "outcome_recorded_at": "2025-01-01T07:00:00+00:00",
    "plan": {
      "goal": "Synthetic test",
      "acceptance": [
        "Result recorded"
      ],
      "steps": [
        {
          "id": "one",
          "description": "deploy production"
        }
      ]
    },
    "tools_used": [],
    "failure_type": "synthetic_only"
  },
  {
    "task_id": "synthetic-4",
    "started_at": "2025-01-01T08:00:00+00:00",
    "finished_at": "2025-01-01T09:00:00+00:00",
    "failed": false,
    "plan_recorded_at": "2025-01-01T08:00:00+00:00",
    "outcome_recorded_at": "2025-01-01T09:00:00+00:00",
    "plan": {
      "goal": "Synthetic test",
      "acceptance": [
        "Result recorded"
      ],
      "steps": [
        {
          "id": "one",
          "description": "inspect local configuration"
        }
      ]
    },
    "tools_used": [],
    "failure_type": ""
  },
  {
    "task_id": "synthetic-5",
    "started_at": "2025-01-01T10:00:00+00:00",
    "finished_at": "2025-01-01T11:00:00+00:00",
    "failed": true,
    "plan_recorded_at": "2025-01-01T10:00:00+00:00",
    "outcome_recorded_at": "2025-01-01T11:00:00+00:00",
    "plan": {
      "goal": "Synthetic test",
      "acceptance": [
        "Result recorded"
      ],
      "steps": [
        {
          "id": "one",
          "description": "deploy production"
        }
      ]
    },
    "tools_used": [],
    "failure_type": "synthetic_only"
  },
  {
    "task_id": "synthetic-6",
    "started_at": "2025-01-01T12:00:00+00:00",
    "finished_at": "2025-01-01T13:00:00+00:00",
    "failed": false,
    "plan_recorded_at": "2025-01-01T12:00:00+00:00",
    "outcome_recorded_at": "2025-01-01T13:00:00+00:00",
    "plan": {
      "goal": "Synthetic test",
      "acceptance": [
        "Result recorded"
      ],
      "steps": [
        {
          "id": "one",
          "description": "inspect local configuration"
        }
      ]
    },
    "tools_used": [],
    "failure_type": ""
  },
  {
    "task_id": "synthetic-7",
    "started_at": "2025-01-01T14:00:00+00:00",
    "finished_at": "2025-01-01T15:00:00+00:00",
    "failed": true,
    "plan_recorded_at": "2025-01-01T14:00:00+00:00",
    "outcome_recorded_at": "2025-01-01T15:00:00+00:00",
    "plan": {
      "goal": "Synthetic test",
      "acceptance": [
        "Result recorded"
      ],
      "steps": [
        {
          "id": "one",
          "description": "deploy production"
        }
      ]
    },
    "tools_used": [],
    "failure_type": "synthetic_only"
  },
  {
    "task_id": "synthetic-8",
    "started_at": "2025-01-01T16:00:00+00:00",
    "finished_at": "2025-01-01T17:00:00+00:00",
    "failed": false,
    "plan_recorded_at": "2025-01-01T16:00:00+00:00",
    "outcome_recorded_at": "2025-01-01T17:00:00+00:00",
    "plan": {
      "goal": "Synthetic test",
      "acceptance": [
        "Result recorded"
      ],
      "steps": [
        {
          "id": "one",
          "description": "inspect local configuration"
        }
      ]
    },
    "tools_used": [],
    "failure_type": ""
  },
  {
    "task_id": "synthetic-9",
    "started_at": "2025-01-01T18:00:00+00:00",
    "finished_at": "2025-01-01T19:00:00+00:00",
    "failed": true,
    "plan_recorded_at": "2025-01-01T18:00:00+00:00",
    "outcome_recorded_at": "2025-01-01T19:00:00+00:00",
    "plan": {
      "goal": "Synthetic test",
      "acceptance": [
        "Result recorded"
      ],
      "steps": [
        {
          "id": "one",
          "description": "deploy production"
        }
      ]
    },
    "tools_used": [],
    "failure_type": "synthetic_only"
  },
  {
    "task_id": "synthetic-10",
    "started_at": "2025-01-01T20:00:00+00:00",
    "finished_at": "2025-01-01T21:00:00+00:00",
    "failed": false,
    "plan_recorded_at": "2025-01-01T20:00:00+00:00",
    "outcome_recorded_at": "2025-01-01T21:00:00+00:00",
    "plan": {
      "goal": "Synthetic test",
      "acceptance": [
        "Result recorded"
      ],
      "steps": [
        {
          "id": "one",
          "description": "inspect local configuration"
        }
      ]
    },
    "tools_used": [],
    "failure_type": ""
  },
  {
    "task_id": "synthetic-11",
    "started_at": "2025-01-01T22:00:00+00:00",
    "finished_at": "2025-01-01T23:00:00+00:00",
    "failed": true,
    "plan_recorded_at": "2025-01-01T22:00:00+00:00",
    "outcome_recorded_at": "2025-01-01T23:00:00+00:00",
    "plan": {
      "goal": "Synthetic test",
      "acceptance": [
        "Result recorded"
      ],
      "steps": [
        {
          "id": "one",
          "description": "deploy production"
        }
      ]
    },
    "tools_used": [],
    "failure_type": "synthetic_only"
  },
  {
    "task_id": "synthetic-12",
    "started_at": "2025-01-02T00:00:00+00:00",
    "finished_at": "2025-01-02T01:00:00+00:00",
    "failed": false,
    "plan_recorded_at": "2025-01-02T00:00:00+00:00",
    "outcome_recorded_at": "2025-01-02T01:00:00+00:00",
    "plan": {
      "goal": "Synthetic test",
      "acceptance": [
        "Result recorded"
      ],
      "steps": [
        {
          "id": "one",
          "description": "inspect local configuration"
        }
      ]
    },
    "tools_used": [],
    "failure_type": ""
  },
  {
    "task_id": "synthetic-13",
    "started_at": "2025-01-02T02:00:00+00:00",
    "finished_at": "2025-01-02T03:00:00+00:00",
    "failed": true,
    "plan_recorded_at": "2025-01-02T02:00:00+00:00",
    "outcome_recorded_at": "2025-01-02T03:00:00+00:00",
    "plan": {
      "goal": "Synthetic test",
      "acceptance": [
        "Result recorded"
      ],
      "steps": [
        {
          "id": "one",
          "description": "deploy production"
        }
      ]
    },
    "tools_used": [],
    "failure_type": "synthetic_only"
  },
  {
    "task_id": "synthetic-14",
    "started_at": "2025-01-02T04:00:00+00:00",
    "finished_at": "2025-01-02T05:00:00+00:00",
    "failed": false,
    "plan_recorded_at": "2025-01-02T04:00:00+00:00",
    "outcome_recorded_at": "2025-01-02T05:00:00+00:00",
    "plan": {
      "goal": "Synthetic test",
      "acceptance": [
        "Result recorded"
      ],
      "steps": [
        {
          "id": "one",
          "description": "inspect local configuration"
        }
      ]
    },
    "tools_used": [],
    "failure_type": ""
  },
  {
    "task_id": "synthetic-15",
    "started_at": "2025-01-02T06:00:00+00:00",
    "finished_at": "2025-01-02T07:00:00+00:00",
    "failed": true,
    "plan_recorded_at": "2025-01-02T06:00:00+00:00",
    "outcome_recorded_at": "2025-01-02T07:00:00+00:00",
    "plan": {
      "goal": "Synthetic test",
      "acceptance": [
        "Result recorded"
      ],
      "steps": [
        {
          "id": "one",
          "description": "deploy production"
        }
      ]
    },
    "tools_used": [],
    "failure_type": "synthetic_only"
  },
  {
    "task_id": "synthetic-16",
    "started_at": "2025-01-02T08:00:00+00:00",
    "finished_at": "2025-01-02T09:00:00+00:00",
    "failed": false,
    "plan_recorded_at": "2025-01-02T08:00:00+00:00",
    "outcome_recorded_at": "2025-01-02T09:00:00+00:00",
    "plan": {
      "goal": "Synthetic test",
      "acceptance": [
        "Result recorded"
      ],
      "steps": [
        {
          "id": "one",
          "description": "inspect local configuration"
        }
      ]
    },
    "tools_used": [],
    "failure_type": ""
  },
  {
    "task_id": "synthetic-17",
    "started_at": "2025-01-02T10:00:00+00:00",
    "finished_at": "2025-01-02T11:00:00+00:00",
    "failed": true,
    "plan_recorded_at": "2025-01-02T10:00:00+00:00",
    "outcome_recorded_at": "2025-01-02T11:00:00+00:00",
    "plan": {
      "goal": "Synthetic test",
      "acceptance": [
        "Result recorded"
      ],
      "steps": [
        {
          "id": "one",
          "description": "deploy production"
        }
      ]
    },
    "tools_used": [],
    "failure_type": "synthetic_only"
  },
  {
    "task_id": "synthetic-18",
    "started_at": "2025-01-02T12:00:00+00:00",
    "finished_at": "2025-01-02T13:00:00+00:00",
    "failed": false,
    "plan_recorded_at": "2025-01-02T12:00:00+00:00",